,userId,id,title
0,1,1,quidem molestiae enim
1,1,2,sunt qui excepturi placeat culpa
2,1,3,omnis laborum odio
3,1,4,non esse culpa molestiae omnis sed optio
4,1,5,eaque aut omnis a
5,1,6,natus impedit quibusdam illo est
6,1,7,quibusdam autem aliquid et et quia
7,1,8,qui fuga est a eum
8,1,9,saepe unde necessitatibus rem
9,1,10,distinctio laborum qui
10,2,11,quam nostrum impedit mollitia quod et dolor
11,2,12,consequatur autem doloribus natus consectetur
12,2,13,ab rerum non rerum consequatur ut ea unde
13,2,14,ducimus molestias eos animi atque nihil
14,2,15,ut pariatur rerum ipsum natus repellendus praesentium
15,2,16,voluptatem aut maxime inventore autem magnam atque repellat
16,2,17,aut minima voluptatem ut velit
17,2,18,nesciunt quia et doloremque
18,2,19,velit pariatur quaerat similique libero omnis quia
19,2,20,voluptas rerum iure ut enim
20,3,21,repudiandae voluptatem optio est consequatur rem in temporibus et
21,3,22,et rem non provident vel ut
22,3,23,incidunt quisquam hic adipisci sequi
23,3,24,dolores ut et facere placeat
24,3,25,vero maxime id possimus sunt neque et consequatur
25,3,26,quibusdam saepe ipsa vel harum
26,3,27,id non nostrum expedita
27,3,28,omnis neque exercitationem sed dolor atque maxime aut cum
28,3,29,inventore ut quasi magnam itaque est fugit
29,3,30,tempora assumenda et similique odit distinctio error
30,4,31,adipisci laborum fuga laboriosam
31,4,32,reiciendis dolores a ut qui debitis non quo labore
32,4,33,iste eos nostrum
33,4,34,cumque voluptatibus rerum architecto blanditiis
34,4,35,et impedit nisi quae magni necessitatibus sed aut pariatur
35,4,36,nihil cupiditate voluptate neque
36,4,37,est placeat dicta ut nisi rerum iste
37,4,38,unde a sequi id
38,4,39,ratione porro illum labore eum aperiam sed
39,4,40,voluptas neque et sint aut quo odit
40,5,41,ea voluptates maiores eos accusantium officiis tempore mollitia consequatur
41,5,42,tenetur explicabo ea
42,5,43,aperiam doloremque nihil
43,5,44,sapiente cum numquam officia consequatur vel natus quos suscipit
44,5,45,tenetur quos ea unde est enim corrupti qui
45,5,46,molestiae voluptate non
46,5,47,temporibus molestiae aut
47,5,48,modi consequatur culpa aut quam soluta alias perspiciatis laudantium
48,5,49,ut aut vero repudiandae voluptas ullam voluptas at consequatur
49,5,50,sed qui sed quas sit ducimus dolor
50,6,51,odit laboriosam sint quia cupiditate animi quis
51,6,52,necessitatibus quas et sunt at voluptatem
52,6,53,est vel sequi voluptatem nemo quam molestiae modi enim
53,6,54,aut non illo amet perferendis
54,6,55,qui culpa itaque omnis in nesciunt architecto error
55,6,56,omnis qui maiores tempora officiis omnis rerum sed repellat
56,6,57,libero excepturi voluptatem est architecto quae voluptatum officia tempora
57,6,58,nulla illo consequatur aspernatur veritatis aut error delectus et
58,6,59,eligendi similique provident nihil
59,6,60,omnis mollitia sunt aliquid eum consequatur fugit minus laudantium
60,7,61,delectus iusto et
61,7,62,eos ea non recusandae iste ut quasi
62,7,63,velit est quam
63,7,64,autem voluptatem amet iure quae
64,7,65,voluptates delectus iure iste qui
65,7,66,velit sed quia dolor dolores delectus
66,7,67,ad voluptas nostrum et nihil
67,7,68,qui quasi nihil aut voluptatum sit dolore minima
68,7,69,qui aut est
69,7,70,et deleniti unde
70,8,71,et vel corporis
71,8,72,unde exercitationem ut
72,8,73,quos omnis officia
73,8,74,quia est eius vitae dolor
74,8,75,aut quia expedita non
75,8,76,dolorem magnam facere itaque ut reprehenderit tenetur corrupti
76,8,77,cupiditate sapiente maiores iusto ducimus cum excepturi veritatis quia
77,8,78,est minima eius possimus ea ratione velit et
78,8,79,ipsa quae voluptas natus ut suscipit soluta quia quidem
79,8,80,id nihil reprehenderit
80,9,81,quibusdam sapiente et
81,9,82,recusandae consequatur vel amet unde
82,9,83,aperiam odio fugiat
83,9,84,est et at eos expedita
84,9,85,qui voluptatem consequatur aut ab quis temporibus praesentium
85,9,86,eligendi mollitia alias aspernatur vel ut iusto
86,9,87,aut aut architecto
87,9,88,quas perspiciatis optio
88,9,89,sit optio id voluptatem est eum et
89,9,90,est vel dignissimos
90,10,91,repellendus praesentium debitis officiis
91,10,92,incidunt et et eligendi assumenda soluta quia recusandae
92,10,93,nisi qui dolores perspiciatis
93,10,94,quisquam a dolores et earum vitae
94,10,95,consectetur vel rerum qui aperiam modi eos aspernatur ipsa
95,10,96,unde et ut molestiae est molestias voluptatem sint
96,10,97,est quod aut
97,10,98,omnis quia possimus nesciunt deleniti assumenda sed autem
98,10,99,consectetur ut id impedit dolores sit ad ex aut
99,10,100,enim repellat iste
